{
  "formatVersion": 1,
  "id": "livingKitchen",
  "size": [800, 260, 650],
  "shapes": [
    { "id": "floor", "type": "box", "center": [0, -5, 0], "size": [820, 10, 670], "flags": ["obstacle", "attachable"] },
    { "id": "ceiling", "type": "box", "center": [0, 265, 0], "size": [820, 10, 670], "flags": ["obstacle", "attachable"] },
    { "id": "wall_north", "type": "box", "center": [0, 130, 330], "size": [820, 260, 10], "flags": ["obstacle", "attachable"] },
    { "id": "wall_south", "type": "box", "center": [0, 130, -330], "size": [820, 260, 10], "flags": ["obstacle", "attachable"] },
    { "id": "wall_east", "type": "box", "center": [405, 130, 0], "size": [10, 260, 650], "flags": ["obstacle", "attachable"] },
    { "id": "wall_west", "type": "box", "center": [-405, 130, 0], "size": [10, 260, 650], "flags": ["obstacle", "attachable"] },
    { "id": "sofa_seat", "type": "box", "center": [-150, 22, 260], "size": [200, 45, 80], "flags": ["obstacle", "attachable"] },
    { "id": "sofa_back", "type": "box", "center": [-150, 65, 295], "size": [200, 40, 10], "flags": ["obstacle", "attachable"] },
    { "id": "tv_stand", "type": "box", "center": [-150, 25, -80], "size": [150, 50, 40], "flags": ["obstacle", "attachable"] },
    { "id": "tv", "type": "box", "center": [-150, 85, -90], "size": [110, 65, 5], "flags": ["obstacle", "attachable"] },
    { "id": "coffee_table_top", "type": "box", "center": [-150, 40, 140], "size": [100, 4, 50], "flags": ["obstacle", "attachable"] },
    { "id": "coffee_table_leg_ne", "type": "box", "center": [-104, 19, 161], "size": [4, 38, 4], "flags": ["obstacle", "attachable"] },
    { "id": "coffee_table_leg_nw", "type": "box", "center": [-196, 19, 161], "size": [4, 38, 4], "flags": ["obstacle", "attachable"] },
    { "id": "coffee_table_leg_se", "type": "box", "center": [-104, 19, 119], "size": [4, 38, 4], "flags": ["obstacle", "attachable"] },
    { "id": "coffee_table_leg_sw", "type": "box", "center": [-196, 19, 119], "size": [4, 38, 4], "flags": ["obstacle", "attachable"] },
    { "id": "shadow_coffee_table", "type": "box", "center": [-150, 19, 140], "size": [88, 38, 38], "flags": ["shadowZone"] },
    { "id": "bookshelf", "type": "box", "center": [70, 90, 50], "size": [40, 180, 100], "flags": ["obstacle", "attachable"] },
    { "id": "shadow_bookshelf", "type": "box", "center": [95, 90, 50], "size": [10, 180, 100], "flags": ["shadowZone"] },
    { "id": "floor_lamp", "type": "capsule", "a": [-350, 15, 250], "b": [-350, 145, 250], "radius": 15, "flags": ["obstacle", "attachable"] },
    { "id": "curtain", "type": "box", "center": [-392, 125, -20], "size": [6, 230, 120], "flags": ["obstacle", "attachable"] },
    { "id": "shadow_curtain", "type": "box", "center": [-397.5, 125, -20], "size": [5, 230, 120], "flags": ["shadowZone"] },
    { "id": "air_conditioner", "type": "box", "center": [30, 220, 312], "size": [90, 30, 25], "flags": ["obstacle", "attachable"] },
    { "id": "hanging_plant", "type": "sphere", "center": [-300, 200, 100], "radius": 15, "flags": ["obstacle", "attachable"] },
    { "id": "kitchen_counter", "type": "box", "center": [370, 45, 0], "size": [60, 90, 400], "flags": ["obstacle", "attachable"] },
    { "id": "kitchen_upper_cabinet", "type": "box", "center": [370, 200, 0], "size": [60, 70, 400], "flags": ["obstacle", "attachable"] },
    { "id": "shadow_under_cabinet", "type": "box", "center": [385, 127, 0], "size": [30, 70, 380], "flags": ["shadowZone"] },
    { "id": "fridge", "type": "box", "center": [360, 90, 285], "size": [70, 180, 70], "flags": ["obstacle", "attachable"] },
    { "id": "kitchen_island", "type": "box", "center": [240, 45, 40], "size": [140, 90, 70], "flags": ["obstacle", "attachable"] },
    { "id": "dining_table_top", "type": "box", "center": [250, 75, -220], "size": [120, 4, 80], "flags": ["obstacle", "attachable"] },
    { "id": "dining_table_leg_ne", "type": "box", "center": [306, 36, -184], "size": [4, 72, 4], "flags": ["obstacle", "attachable"] },
    { "id": "dining_table_leg_nw", "type": "box", "center": [194, 36, -184], "size": [4, 72, 4], "flags": ["obstacle", "attachable"] },
    { "id": "dining_table_leg_se", "type": "box", "center": [306, 36, -256], "size": [4, 72, 4], "flags": ["obstacle", "attachable"] },
    { "id": "dining_table_leg_sw", "type": "box", "center": [194, 36, -256], "size": [4, 72, 4], "flags": ["obstacle", "attachable"] },
    { "id": "shadow_dining_table", "type": "box", "center": [250, 36, -220], "size": [108, 70, 68], "flags": ["shadowZone"] },
    { "id": "dining_chair_n", "type": "box", "center": [250, 25, -150], "size": [40, 50, 40], "flags": ["obstacle", "attachable"] },
    { "id": "dining_chair_s", "type": "box", "center": [250, 25, -290], "size": [40, 50, 40], "flags": ["obstacle", "attachable"] },
    { "id": "dining_lamp", "type": "sphere", "center": [250, 200, -220], "radius": 18, "flags": ["obstacle", "attachable"] },
    { "id": "shoe_cabinet", "type": "box", "center": [-60, 50, -310], "size": [120, 100, 30], "flags": ["obstacle", "attachable"] }
  ]
}
